{
  "schema_version": "1.0",
  "started_at": "2026-07-28T01:00:00+00:00",
  "finished_at": "2026-07-28T01:18:30+00:00",
  "planned_runs": 1,
  "attempts_used": 1,
  "completed_runs": 1,
  "passed_runs": 1,
  "completion_rate": 1.0,
  "citation_validity": 1.0,
  "total_tokens": 12800,
  "total_cost_rmb": 0.12,
  "total_search_credits": 3,
  "cases": [
    {
      "category": "market",
      "status": "completed",
      "passed": true,
      "completed_steps": 3,
      "unique_sources": 5,
      "citation_validity": 1.0,
      "total_tokens": 12800,
      "cost_rmb": 0.12,
      "search_credits": 3,
      "elapsed_seconds": 420.5,
      "error_code": ""
    }
  ]
}
